Age,Category,Criteria
7-Year-Old,Vocabulary,"Uses 3,000+ words; Understands descriptive language and abstract concepts"
7-Year-Old,Sentence Structure,Uses varied sentence structures with embedded clauses; Describes complex scenarios
7-Year-Old,Comprehension,Follows complex instructions; Understands 'if-then' scenarios
7-Year-Old,Speech Clarity,Speech is fully clear and understandable by all listeners
7-Year-Old,Social Communication,Participates in discussions; Adjusts language based on the audience
7-Year-Old,Emerging Literacy,Writes longer texts with detailed stories; Reads independently; Comprehends advanced material
